[
  {
    "id": "arena_training",
    "name": "Training Pit",
    "weight_cap": 50,
    "entry_fee": 0,
    "size": {"width": 600, "height": 400},
    "obstacles": [],
    "spawn_points_player": [{"x": 100, "y": 200}],
    "spawn_points_enemy": [{"x": 500, "y": 200}],
    "waves": [
      {"spawn_tick": 0, "enemies": ["enemy_scout_t1"]}
    ],
    "victory_condition": "eliminate"
  },
  {
    "id": "arena_scrapyard",
    "name": "Scrapyard Ring",
    "weight_cap": 70,
    "entry_fee": 50,
    "size": {"width": 800, "height": 600},
    "obstacles": [
      {"type": "cover", "x": 350, "y": 250, "width": 100, "height": 40},
      {"type": "cover", "x": 350, "y": 310, "width": 100, "height": 40},
      {"type": "wall", "x": 0, "y": 0, "width": 20, "height": 600},
      {"type": "wall", "x": 780, "y": 0, "width": 20, "height": 600}
    ],
    "spawn_points_player": [{"x": 100, "y": 200}, {"x": 100, "y": 400}],
    "spawn_points_enemy": [{"x": 700, "y": 200}, {"x": 700, "y": 400}],
    "waves": [
      {"spawn_tick": 0, "enemies": ["enemy_fighter_t1", "enemy_scout_t1"]}
    ],
    "victory_condition": "eliminate"
  },
  {
    "id": "arena_minefield",
    "name": "The Minefield",
    "weight_cap": 90,
    "entry_fee": 100,
    "size": {"width": 1000, "height": 700},
    "obstacles": [
      {"type": "hazard_mine", "x": 400, "y": 300, "width": 16, "height": 16, "damage": 40, "trigger_radius": 30},
      {"type": "hazard_mine", "x": 500, "y": 350, "width": 16, "height": 16, "damage": 40, "trigger_radius": 30},
      {"type": "hazard_mine", "x": 600, "y": 250, "width": 16, "height": 16, "damage": 40, "trigger_radius": 30},
      {"type": "hazard_mine", "x": 450, "y": 450, "width": 16, "height": 16, "damage": 40, "trigger_radius": 30},
      {"type": "wall", "x": 250, "y": 100, "width": 20, "height": 200},
      {"type": "wall", "x": 730, "y": 400, "width": 20, "height": 200},
      {"type": "cover", "x": 480, "y": 150, "width": 60, "height": 30}
    ],
    "spawn_points_player": [{"x": 100, "y": 250}, {"x": 100, "y": 450}],
    "spawn_points_enemy": [{"x": 900, "y": 200}, {"x": 900, "y": 400}, {"x": 900, "y": 550}],
    "waves": [
      {"spawn_tick": 0, "enemies": ["enemy_tank_t1", "enemy_fighter_t1"]},
      {"spawn_tick": 600, "enemies": ["enemy_sniper_t2"]}
    ],
    "victory_condition": "eliminate"
  }
]
